id_str,created_at,full_text,normalized_text,favorite_count,reply_count,retweet_count,full_text_no_hashtag
1971859858397057053,Sat Sep 27 08:50:00 +0000 2025,Kerap Mengkritik Pemerintah Purbayaâ€‹â€‹ Tantang Rocky Gerung Minta Maaf! https://t.co/b3tgx1nHRx,kerap mengkritik pemerintah purbaya tantang rocky gerung minta maaf,3,2,1,Kerap Mengkritik Pemerintah Purbayaâ€‹â€‹ Tantang Rocky Gerung Minta Maaf! https://t.co/b3tgx1nHRx
1971859796950409239,Sat Sep 27 08:49:45 +0000 2025,DPR Dukung Menkeu Purbaya Tak Naikkan Cukai Rokok 2026 https://t.co/zrFkBCi0U5 via @InvestorID,dpr dukung menkeu purbaya tak naikkan cukai rokok via,1,0,1,DPR Dukung Menkeu Purbaya Tak Naikkan Cukai Rokok 2026 https://t.co/zrFkBCi0U5 via @InvestorID
1971857430998114443,Sat Sep 27 08:40:21 +0000 2025,Menteri KeuanganÂ Purbaya Yudhi SadewaÂ memutuskan untuk menunda sementara rencana pemungutan pajak dari pedagang e-commerce. https://t.co/FcLEiDFqpL @AidilAKBAR,menteri keuangan purbaya yudhi sadewa memutuskan untuk menunda sementara rencana pemungutan pajak dari pedagang ecommerce,0,0,0,Menteri KeuanganÂ Purbaya Yudhi SadewaÂ memutuskan untuk menunda sementara rencana pemungutan pajak dari pedagang e-commerce. https://t.co/FcLEiDFqpL @AidilAKBAR
1971857341608800476,Sat Sep 27 08:40:00 +0000 2025,Komentar Menkeu Purbaya Kala Singgung Rocky Gerung Hotman hingga Ketua Banggar DPR - PARASOT https://t.co/Jjz6wr8s7P,komentar menkeu purbaya kala singgung rocky gerung hotman hingga ketua banggar dpr parasot,3,0,1,Komentar Menkeu Purbaya Kala Singgung Rocky Gerung Hotman hingga Ketua Banggar DPR - PARASOT https://t.co/Jjz6wr8s7P
1971850793889194081,Sat Sep 27 08:13:59 +0000 2025,DPR Dukung Menkeu Purbaya Tak Naikkan Cukai Rokok 2026 https://t.co/zrFkBCht4x,dpr dukung menkeu purbaya tak naikkan cukai rokok,0,0,0,DPR Dukung Menkeu Purbaya Tak Naikkan Cukai Rokok 2026 https://t.co/zrFkBCht4x
1971850560958878083,Sat Sep 27 08:13:03 +0000 2025,Tarif Cukai Rokok 2026 Tak Naik Purbaya Fokus Berantas Rokok Ilegal &amp;amp; Sentralisasi IHT https://t.co/kGQvTxogNk,tarif cukai rokok tak naik purbaya fokus berantas rokok ilegal ampamp sentralisasi iht,0,0,0,Tarif Cukai Rokok 2026 Tak Naik Purbaya Fokus Berantas Rokok Ilegal &amp;amp; Sentralisasi IHT https://t.co/kGQvTxogNk
1971847698644148705,Sat Sep 27 08:01:41 +0000 2025,Bertemu dengan Menteri Keuangan Bapak Purbaya Yudhi Sadewa untuk berkolaborasi mewujudkan Asta Cita Bapak Presiden dalam memperkuat pembangunan sumber daya manusia prestasi olahraga penguatan peran pemuda dan pemudi Indonesia. Kami di Kementerian Pemuda dan Olahraga akan https://t.co/7IcBos2JyX,beemu dengan menteri keuangan bapak purbaya yudhi sadewa untuk berkolaborasi mewujudkan asta cita bapak presiden dalam memperkuat pembangunan sumber daya manusia prestasi olahraga penguatan peran pemuda dan pemudi indonesia kami kementerian pemuda dan olahraga akan,661,49,33,Bertemu dengan Menteri Keuangan Bapak Purbaya Yudhi Sadewa untuk berkolaborasi mewujudkan Asta Cita Bapak Presiden dalam memperkuat pembangunan sumber daya manusia prestasi olahraga penguatan peran pemuda dan pemudi Indonesia. Kami di Kementerian Pemuda dan Olahraga akan https://t.co/7IcBos2JyX
1971847643862388962,Sat Sep 27 08:01:28 +0000 2025,Menkeu Purbaya peringatkan crazy rich untuk patuh bayar pajak https://t.co/kRGwxYtU5p,menkeu purbaya peringatkan crazy rich untuk patuh bayar pajak,0,0,0,Menkeu Purbaya peringatkan crazy rich untuk patuh bayar pajak https://t.co/kRGwxYtU5p
1971846436024197443,Sat Sep 27 07:56:40 +0000 2025,Pemerintah memutuskan menunda penerapan Pajak Penghasilan (PPh) Pasal 22 sebesar 0 5% untuk transaksi e-commerce demi menjaga stabilitas daya beli masyarakat di tengah upaya stimulus ekonomi. Keputusan ini diumumkan Menteri Keuangan Purbaya Yudhi Sadewa yang menekankan https://t.co/r2sGvfXUQE,pemerintah memutuskan menunda penerapan pajak penghasilan pph pasal sebesar untuk transaksi ecommerce demi menjaga stabilitas daya beli masyarakat tengah upaya stimulus ekonomi keputusan ini diumumkan menteri keuangan purbaya yudhi sadewa yang menekankan,1,0,0,Pemerintah memutuskan menunda penerapan Pajak Penghasilan (PPh) Pasal 22 sebesar 0 5% untuk transaksi e-commerce demi menjaga stabilitas daya beli masyarakat di tengah upaya stimulus ekonomi. Keputusan ini diumumkan Menteri Keuangan Purbaya Yudhi Sadewa yang menekankan https://t.co/r2sGvfXUQE
1971846133233095069,Sat Sep 27 07:55:27 +0000 2025,Punya Harta Lebih Setengah Triliun Istri Purbaya Yudhi Sadewa Pilih Naik Bajaj Daripada Mercy https://t.co/o9EjYpy0VO,punya haa lebih setengah triliun istri purbaya yudhi sadewa pilih naik bajaj daripada mercy,0,0,0,Punya Harta Lebih Setengah Triliun Istri Purbaya Yudhi Sadewa Pilih Naik Bajaj Daripada Mercy https://t.co/o9EjYpy0VO
1971845437385855023,Sat Sep 27 07:52:42 +0000 2025,@Fahrihamzah Feui? Menko ekonomi mesin bulaksumur. Menteri keuangan elektro ganesha. Airlangga diperpanjang dr era jkw artinya anak feui ga sanggup lawan. purbaya? gantiin anak feui yg gagal (smi). Kebanyakan maen politik sih tuh salemba xoxoxlah dpt ketua iluni lawyer gaje,feui menko ekonomi mesin bulaksumur menteri keuangan elektro ganesha airlangga diperpanjang dari era jkw ainya anak feui tidak sanggup lawan purbaya gantiin anak feui yang gagal smi kebanyakan maen politik sih tuh salemba xoxoxlah dpt ketua iluni lawyer gaje,0,1,0,@Fahrihamzah Feui? Menko ekonomi mesin bulaksumur. Menteri keuangan elektro ganesha. Airlangga diperpanjang dr era jkw artinya anak feui ga sanggup lawan. purbaya? gantiin anak feui yg gagal (smi). Kebanyakan maen politik sih tuh salemba xoxoxlah dpt ketua iluni lawyer gaje
1971844712484294933,Sat Sep 27 07:49:49 +0000 2025,@oknumwarga @BaseAnakFK Beberapa menteri di Kabinet Merah Putih Prabowo dengan latar belakang teknik (berdasarkan data terkini Sept 2025): - Purbaya Yudhi Sadewa (Menteri Keuangan): Teknik Elektro ITB. - Brian Yuliarto (Menteri Pendidikan Tinggi Sains Teknologi): Teknik Fisika ITB. - Yassierli,beberapa menteri kabinet merah putih prabowo dengan latar belakang teknik berdasarkan data terkini sept purbaya yudhi sadewa menteri keuangan teknik elektro itb brian yuliao menteri pendidikan tinggi sains teknologi teknik fisika itb yassierli,1,0,0,@oknumwarga @BaseAnakFK Beberapa menteri di Kabinet Merah Putih Prabowo dengan latar belakang teknik (berdasarkan data terkini Sept 2025): - Purbaya Yudhi Sadewa (Menteri Keuangan): Teknik Elektro ITB. - Brian Yuliarto (Menteri Pendidikan Tinggi Sains Teknologi): Teknik Fisika ITB. - Yassierli
1971842855925866514,Sat Sep 27 07:42:26 +0000 2025,BREAKING NEWS Kemenkeu Purbaya menunda pemungutan pajak penghasilan (PPH) E-Comerce sebesar 0 5% bagi pedagang,breaking news kemenkeu purbaya menunda pemungutan pajak penghasilan pph ecomerce sebesar bagi pedagang,0,0,0,BREAKING NEWS Kemenkeu Purbaya menunda pemungutan pajak penghasilan (PPH) E-Comerce sebesar 0 5% bagi pedagang
1971841871787053524,Sat Sep 27 07:38:31 +0000 2025,Menkeu Purbaya Pastikan Tarif Cukai Rokok Tak Naik di 2026 Simak Selengkapnya : https://t.co/YaGcVDXzW2 Baca artikel lainnya di : https://t.co/fH6UsGK7Aw #News #Most1058 #Menkeu #Purbaya #Tarif #Cukai,menkeu purbaya pastikan tarif cukai rokok tak naik simak selengkapnya baca aikel lainnya,1,0,0,Menkeu Purbaya Pastikan Tarif Cukai Rokok Tak Naik di 2026 Simak Selengkapnya : https://t.co/YaGcVDXzW2 Baca artikel lainnya di : https://t.co/fH6UsGK7Aw
1971840404829196442,Sat Sep 27 07:32:42 +0000 2025,Alasan Purbaya Incar Dana Pemda Rp 233 T yang Nganggur di Bank https://t.co/OEGeXOsSGu,alasan purbaya incar dana pemda yang nganggur bank,2,0,1,Alasan Purbaya Incar Dana Pemda Rp 233 T yang Nganggur di Bank https://t.co/OEGeXOsSGu
1971839667411845265,Sat Sep 27 07:29:46 +0000 2025,RG tidak harus minta maaf! justru kritikan RG menjadi cambuk bagi Purbaya utk membuktikan kemampuannya.,tidak harus minta maaf justru kritikan menjadi cambuk bagi purbaya untuk membuktikan kemampuannya,0,0,0,RG tidak harus minta maaf! justru kritikan RG menjadi cambuk bagi Purbaya utk membuktikan kemampuannya.
1971839432413376819,Sat Sep 27 07:28:50 +0000 2025,Menkeu Purbaya Tunda Pajak E-Commerce 0 5% Demi Lindungi Daya Beli Masyarakat https://t.co/Lx5si4Im0H https://t.co/xDOqRuScjN,menkeu purbaya tunda pajak ecommerce demi lindungi daya beli masyarakat,0,0,0,Menkeu Purbaya Tunda Pajak E-Commerce 0 5% Demi Lindungi Daya Beli Masyarakat https://t.co/Lx5si4Im0H https://t.co/xDOqRuScjN
1971839220408021219,Sat Sep 27 07:27:59 +0000 2025,Menkeu Purbaya menyampaikan pesan penting dari Presiden Prabowo kepada jajaran kabinet. Pesan tersebut menekankan pentingnya integritas dan semangat nasionalisme dalam setiap pekerjaan https://t.co/MNuzocep3n,menkeu purbaya menyampaikan pesan penting dari presiden prabowo kepada jajaran kabinet pesan tersebut menekankan pentingnya integritas dan semangat nasionalisme dalam setiap pekerjaan,0,0,0,Menkeu Purbaya menyampaikan pesan penting dari Presiden Prabowo kepada jajaran kabinet. Pesan tersebut menekankan pentingnya integritas dan semangat nasionalisme dalam setiap pekerjaan https://t.co/MNuzocep3n
1971838641317241314,Sat Sep 27 07:25:41 +0000 2025,Rupiah Jeblok ke Rp16.700 per Dolar AS Begini Respons Purbaya https://t.co/wrpWJcBTqa https://t.co/1ZmhjfQsjr,rupiah jeblok per dolar begini respons purbaya,0,0,0,Rupiah Jeblok ke Rp16.700 per Dolar AS Begini Respons Purbaya https://t.co/wrpWJcBTqa https://t.co/1ZmhjfQsjr
1971836589354766733,Sat Sep 27 07:17:32 +0000 2025,@JoshuaOchu34866 @AnKiiim_ ? Liat video fullnya iq 78 itu purbaya bukan nolak investasi asing. Tapi jelasin mekanisme investasi asing itu gimana dan apa yg harus diciptakan buat narik investasi itu.,liat video fullnya itu purbaya bukan nolak investasi asing tapi jelasin mekanisme investasi asing itu gimana dan apa yang harus diciptakan buat narik investasi itu,0,0,0,@JoshuaOchu34866 @AnKiiim_ ? Liat video fullnya iq 78 itu purbaya bukan nolak investasi asing. Tapi jelasin mekanisme investasi asing itu gimana dan apa yg harus diciptakan buat narik investasi itu.
1971832981129240635,Sat Sep 27 07:03:12 +0000 2025,Strategi Lawan Rokok Ilegal Menkeu Purbaya: Cukai Rokok 2026 Tidak Naik https://t.co/aDXA1koCTo https://t.co/UBITBhMLmX,strategi lawan rokok ilegal menkeu purbaya cukai rokok tidak naik,0,0,0,Strategi Lawan Rokok Ilegal Menkeu Purbaya: Cukai Rokok 2026 Tidak Naik https://t.co/aDXA1koCTo https://t.co/UBITBhMLmX
1971832181191594255,Sat Sep 27 07:00:01 +0000 2025,Gertakan Menkeu Purbaya Yudhi Sadewa sukses membuat nyali para pengemplang pajak ciut. Sebanyak 84 dari 200 penunggak pajak jumbo telah menyetorkan tunggakannya ke negara sebesar Rp 5 triliun. Berita selengkapnya klik https://t.co/sijTwcPROE #prubaya #pajak https://t.co/dzYu7QqhQ6,geakan menkeu purbaya yudhi sadewa sukses membuat nyali para pengemplang pajak ciut sebanyak dari penunggak pajak jumbo telah menyetorkan tunggakannya negara sebesar triliun berita selengkapnya klik,0,0,0,Gertakan Menkeu Purbaya Yudhi Sadewa sukses membuat nyali para pengemplang pajak ciut. Sebanyak 84 dari 200 penunggak pajak jumbo telah menyetorkan tunggakannya ke negara sebesar Rp 5 triliun. Berita selengkapnya klik https://t.co/sijTwcPROE   https://t.co/dzYu7QqhQ6
1971831665686376709,Sat Sep 27 06:57:58 +0000 2025,Terungkap Dapur Fiktif MBG dan Tantangan Serapan Anggaran: Menkeu Purbaya Kerahkan Anak Buah Kawal Pelaksanaan Dilapangan https://t.co/WzR0XQ6LLE,terungkap dapur fiktif mbg dan tantangan serapan anggaran menkeu purbaya kerahkan anak buah kawal pelaksanaan dilapangan,0,0,0,Terungkap Dapur Fiktif MBG dan Tantangan Serapan Anggaran: Menkeu Purbaya Kerahkan Anak Buah Kawal Pelaksanaan Dilapangan https://t.co/WzR0XQ6LLE
1971829587245183036,Sat Sep 27 06:49:43 +0000 2025,Purbaya dan Larangan Praktik Iktinaz dalam Islam Baca selengkapnya disini https://t.co/d19YvaQ2zh Sumber : Foto Anwar Abbas/Penulis Danang JM #imbcnews #purbaya #larangan #praktik #iktinaz https://t.co/OlVqIKI30V,purbaya dan larangan praktik iktinaz dalam islam baca selengkapnya disini sumber foto anwar abbaspenulis danang,1,0,0,Purbaya dan Larangan Praktik Iktinaz dalam Islam Baca selengkapnya disini https://t.co/d19YvaQ2zh Sumber : Foto Anwar Abbas/Penulis Danang JM      https://t.co/OlVqIKI30V
1971825507735060619,Sat Sep 27 06:33:30 +0000 2025,Purbaya Yudhi Sadewa pede rupiah bakal kinclong minggu depan karena pasar udah yakin sama roadmap ekonomi kita https://t.co/HM5lfTo6TF,purbaya yudhi sadewa pede rupiah bakal kinclong minggu depan karena pasar udah yakin sama roadmap ekonomi kita,0,0,0,Purbaya Yudhi Sadewa pede rupiah bakal kinclong minggu depan karena pasar udah yakin sama roadmap ekonomi kita https://t.co/HM5lfTo6TF
1971821172502548844,Sat Sep 27 06:16:16 +0000 2025,Purbaya Buka Suara soal Rupiah Amblas ke Rp16.700 per Dolar AS https://t.co/PlkvE6BHmb lewat @YouTube,purbaya buka suara soal rupiah amblas per dolar lewat,0,0,0,Purbaya Buka Suara soal Rupiah Amblas ke Rp16.700 per Dolar AS https://t.co/PlkvE6BHmb lewat @YouTube
1971820456845214095,Sat Sep 27 06:13:26 +0000 2025,@AnKiiim_ INVESTOR2 PAHAM JOKOWI DAPAT PREDIKAT OCCRP... DAN INVESTOR2 SEGAN TANAM MODAL DI INDONESIA BANYAK MALING PREMAN2 PALAK2 INVESTOR2. PURBAYA TIDAK PAHAM... HAMA WERENG SANGAT BERBAHAYA UNTUK PADI. PURBAYA LULUSAN SARJANA APA ?. PREMAN2 MIRIP HAMA WERENG.,investor paham jokowi dapat predikat occrp dan investor segan tanam modal indonesia banyak maling preman palak investor purbaya tidak paham hama wereng sangat berbahaya untuk padi purbaya lulusan sarjana apa preman mirip hama wereng,1,0,0,@AnKiiim_ INVESTOR2 PAHAM JOKOWI DAPAT PREDIKAT OCCRP... DAN INVESTOR2 SEGAN TANAM MODAL DI INDONESIA BANYAK MALING PREMAN2 PALAK2 INVESTOR2. PURBAYA TIDAK PAHAM... HAMA WERENG SANGAT BERBAHAYA UNTUK PADI. PURBAYA LULUSAN SARJANA APA ?. PREMAN2 MIRIP HAMA WERENG.
1971816009762775472,Sat Sep 27 05:55:45 +0000 2025,DPR Dukung Kebijakan Menkeu Purbaya yang Tidak Menaikkan Tarif Cukai Hasil Tembakau di 2026 https://t.co/GdW5v4s7L9,dpr dukung kebijakan menkeu purbaya yang tidak menaikkan tarif cukai hasil tembakau,0,1,0,DPR Dukung Kebijakan Menkeu Purbaya yang Tidak Menaikkan Tarif Cukai Hasil Tembakau di 2026 https://t.co/GdW5v4s7L9
1971814461922222342,Sat Sep 27 05:49:36 +0000 2025,Dengan Intervensi BI rupiah siap balas dendam minggu depan seperti kata Purbaya Yudhi Sadewa https://t.co/wvOZyZ0yyA,dengan intervensi rupiah siap balas dendam minggu depan sepei kata purbaya yudhi sadewa,0,0,0,Dengan Intervensi BI rupiah siap balas dendam minggu depan seperti kata Purbaya Yudhi Sadewa https://t.co/wvOZyZ0yyA
1971812026738790404,Sat Sep 27 05:39:56 +0000 2025,Menkeu Purbaya Perketat Jerat Pajak Crazy Rich Tak Bisa Lagi Menghindar https://t.co/KVy4X20ugO,menkeu purbaya perketat jerat pajak crazy rich tak bisa lagi menghindar,0,0,0,Menkeu Purbaya Perketat Jerat Pajak Crazy Rich Tak Bisa Lagi Menghindar https://t.co/KVy4X20ugO
1971811921428160566,Sat Sep 27 05:39:31 +0000 2025,@Luckytraderr__ kalai kemarin purbaya gak mainin 200T buat disebar ke bank bumn apa memungkinkan juga rp kita melemah?,kalai kemarin purbaya tidak mainin buat disebar bank bumn apa memungkinkan juga kita melemah,1,1,0,@Luckytraderr__ kalai kemarin purbaya gak mainin 200T buat disebar ke bank bumn apa memungkinkan juga rp kita melemah?
1971811205041045700,Sat Sep 27 05:36:40 +0000 2025, Menurut saya langkah Pak Purbaya untuk tidak menaikkan cukai hasil tembakau di 2026 itu adalah langkah yang tepat dan perlu diberikan dukungan kata Misbakhun #rokok #pajak #cukai #menkeu Baca selengkapnya https://t.co/dJyTgvoOom https://t.co/SNYWL9wI5O,menurut saya langkah pak purbaya untuk tidak menaikkan cukai hasil tembakau itu adalah langkah yang tepat dan perlu diberikan dukungan kata misbakhun baca selengkapnya,1,0,0,Menurut saya langkah Pak Purbaya untuk tidak menaikkan cukai hasil tembakau di 2026 itu adalah langkah yang tepat dan perlu diberikan dukungan kata Misbakhun     Baca selengkapnya https://t.co/dJyTgvoOom https://t.co/SNYWL9wI5O
1971806788774514755,Sat Sep 27 05:19:07 +0000 2025,@Giiselje Terus wajib pajak yang sudah ada dicari cari kesalahannya untuk nutupi kurang pajak? Tolol lo purbaya,terus wajib pajak yang sudah ada dicari cari kesalahannya untuk nutupi kurang pajak tolol purbaya,0,6,0,@Giiselje Terus wajib pajak yang sudah ada dicari cari kesalahannya untuk nutupi kurang pajak? Tolol lo purbaya
1971802901325795573,Sat Sep 27 05:03:40 +0000 2025,RISIKO BESAR MENKEU PURBAYA https://t.co/cUlX0gTQqP https://t.co/Oja40SoUJO,risiko besar menkeu purbaya,0,0,0,RISIKO BESAR MENKEU PURBAYA https://t.co/cUlX0gTQqP https://t.co/Oja40SoUJO
1971801637871407532,Sat Sep 27 04:58:39 +0000 2025,Klo atasanku modelan Pak Purbaya mau kerja lembur ngalor ngidul weekend hantam kerja juga I won't mind at all. May he always be health and protected.,kalau atasanku modelan pak purbaya mau kerja lembur ngalor ngidul weekend hantam kerja juga wont mind all may always health and protected,0,0,0,Klo atasanku modelan Pak Purbaya mau kerja lembur ngalor ngidul weekend hantam kerja juga I won't mind at all. May he always be health and protected.
1971801019932643782,Sat Sep 27 04:56:12 +0000 2025,Ekonom UGM Dukung Keputusan Menkeu Purbaya Tolak Tax Amnesty https://t.co/7Kb8gFflyn https://t.co/0ndQ2hzUXe,ekonom ugm dukung keputusan menkeu purbaya tolak tax amnesty,0,0,0,Ekonom UGM Dukung Keputusan Menkeu Purbaya Tolak Tax Amnesty https://t.co/7Kb8gFflyn https://t.co/0ndQ2hzUXe
1971800002029932660,Sat Sep 27 04:52:09 +0000 2025,waakkaakka kalo sampe ketauan bos purbaya bahaya soalnya,waakkaakka kalau sampe ketauan bos purbaya bahaya soalnya,1,0,0,waakkaakka kalo sampe ketauan bos purbaya bahaya soalnya
1971799762925244449,Sat Sep 27 04:51:12 +0000 2025,Purbaya Yudhi Sadewa jamin penguatan rupiah lanjut terus seiring aktivitas ekonomi yang rame https://t.co/H05IIduHPk,purbaya yudhi sadewa jamin penguatan rupiah lanjut terus seiring aktivitas ekonomi yang rame,0,0,0,Purbaya Yudhi Sadewa jamin penguatan rupiah lanjut terus seiring aktivitas ekonomi yang rame https://t.co/H05IIduHPk
1971798073295991005,Sat Sep 27 04:44:29 +0000 2025,Alasan Purbaya Incar Dana Pemda Rp 233 T yang Nganggur di Bank https://t.co/bnxoPddmSK,alasan purbaya incar dana pemda yang nganggur bank,87,20,14,Alasan Purbaya Incar Dana Pemda Rp 233 T yang Nganggur di Bank https://t.co/bnxoPddmSK
1971794004414275812,Sat Sep 27 04:28:19 +0000 2025,Pengusaha dan Pekerja ingin Menkeu Purbaya Moratorium Cukai Rokok https://t.co/GullTI0ypf,pengusaha dan pekerja ingin menkeu purbaya moratorium cukai rokok,1,0,0,Pengusaha dan Pekerja ingin Menkeu Purbaya Moratorium Cukai Rokok https://t.co/GullTI0ypf
1971790206845198375,Sat Sep 27 04:13:14 +0000 2025, Video Baru: RISIKO BESAR MENKEU PURBAYA https://t.co/yTFP6oVe7H,video baru risiko besar menkeu purbaya,0,0,0,Video Baru: RISIKO BESAR MENKEU PURBAYA https://t.co/yTFP6oVe7H
1971788861492940987,Sat Sep 27 04:07:53 +0000 2025,@Metro_TV Saya mendukung pak purbaya jadi presiden,saya mendukung pak purbaya jadi presiden,0,0,0,@Metro_TV Saya mendukung pak purbaya jadi presiden
1971787071569420394,Sat Sep 27 04:00:46 +0000 2025,@PaltiWest Program Rentenir Purbaya Purak purak Banyak Gaya,program rentenir purbaya purak purak banyak gaya,1,0,0,@PaltiWest Program Rentenir Purbaya Purak purak Banyak Gaya
1971786783177560400,Sat Sep 27 03:59:37 +0000 2025,Alasan Menkeu Purbaya Tunda Pungut Pajak Pedagang Online Kebijakan yang Diterbitkan Sri Mulyani https://t.co/SdJpTy5jRL via @tribunmedan,alasan menkeu purbaya tunda pungut pajak pedagang online kebijakan yang diterbitkan sri mulyani via,0,0,0,Alasan Menkeu Purbaya Tunda Pungut Pajak Pedagang Online Kebijakan yang Diterbitkan Sri Mulyani https://t.co/SdJpTy5jRL via @tribunmedan
1971784257254338969,Sat Sep 27 03:49:35 +0000 2025,@CakKhum purbaya jg di era mul dijegal.,purbaya juga era mul dijegal,1,0,0,@CakKhum purbaya jg di era mul dijegal.
1971781792916226227,Sat Sep 27 03:39:48 +0000 2025,@Lurahkombat354 @Metro_TV @purbaya Sat set gercep,sat set gercep,0,0,0,@Lurahkombat354 @Metro_TV @purbaya Sat set gercep
1971778257138995321,Sat Sep 27 03:25:45 +0000 2025,@irkif_luz @CNNIndonesia @rockygerung @ipung_purbaya @KemenkeuRI @prastow Target Prabowo 8% dia bikit target 6% sementara saat ini sekitar 5% Asal jangan ngakal2i data seperti angka BPS,target prabowo dia bikit target sementara saat ini sekitar asal jangan ngakali data sepei angka bps,1,1,0,@irkif_luz @CNNIndonesia @rockygerung @ipung_purbaya @KemenkeuRI @prastow Target Prabowo 8% dia bikit target 6% sementara saat ini sekitar 5% Asal jangan ngakal2i data seperti angka BPS
1971777576780865613,Sat Sep 27 03:23:02 +0000 2025,Purbaya Tunda Penerapan PPh Pedagang Online 0 5 Persen https://t.co/Lj7wxTbPuB,purbaya tunda penerapan pph pedagang online persen,0,0,0,Purbaya Tunda Penerapan PPh Pedagang Online 0 5 Persen https://t.co/Lj7wxTbPuB
1971776811148198399,Sat Sep 27 03:20:00 +0000 2025,Purbaya Tantang Rocky Gerung Minta Maaf Jika Ekonomi Tumbuh 6% https://t.co/ZekSOjuwx2,purbaya tantang rocky gerung minta maaf jika ekonomi tumbuh,81,21,7,Purbaya Tantang Rocky Gerung Minta Maaf Jika Ekonomi Tumbuh 6% https://t.co/ZekSOjuwx2
1971776074330812595,Sat Sep 27 03:17:04 +0000 2025,Lawan deh tuh Pak Menkeu... Purbaya: Kalau Ekonomi Tumbuh 6 Persen Rocky Gerung Harus Minta Maaf https://t.co/M26ingj4yY,lawan deh tuh pak menkeu purbaya kalau ekonomi tumbuh persen rocky gerung harus minta maaf,2,0,0,Lawan deh tuh Pak Menkeu... Purbaya: Kalau Ekonomi Tumbuh 6 Persen Rocky Gerung Harus Minta Maaf https://t.co/M26ingj4yY
1971775191308292422,Sat Sep 27 03:13:34 +0000 2025,Kemarin Carper Sama Rocky Gerung Giliran Dikritik Cuma Tukang Bayar Purbaya Langsung Baperan.. Kalau cuma naikin 5-6 persen mah bukannya sekarang juga sudah 5 12 persen?! Percuma juga ekonomi cuma angka kalau janji 19 juta pekerjaan tidak dipenuhi.. https://t.co/65MxtaVd5D,kemarin carper sama rocky gerung giliran dikritik cuma tukang bayar purbaya langsung baperan kalau cuma naikin persen mah bukannya sekarang juga sudah persen percuma juga ekonomi cuma angka kalau janji juta pekerjaan tidak dipenuhi,227,14,72,Kemarin Carper Sama Rocky Gerung Giliran Dikritik Cuma Tukang Bayar Purbaya Langsung Baperan.. Kalau cuma naikin 5-6 persen mah bukannya sekarang juga sudah 5 12 persen?! Percuma juga ekonomi cuma angka kalau janji 19 juta pekerjaan tidak dipenuhi.. https://t.co/65MxtaVd5D
1971774951654117572,Sat Sep 27 03:12:36 +0000 2025,Menkeu Pastikan Tarif Cukai Rokok 2026 Tidak Naik Begini Strategi Purbaya Atasi Rokok Ilegal https://t.co/C5ru13x91W,menkeu pastikan tarif cukai rokok tidak naik begini strategi purbaya atasi rokok ilegal,0,0,0,Menkeu Pastikan Tarif Cukai Rokok 2026 Tidak Naik Begini Strategi Purbaya Atasi Rokok Ilegal https://t.co/C5ru13x91W
1971772838140170464,Sat Sep 27 03:04:13 +0000 2025,Pak purbaya ini menjelaskan dg bahasa awam dicari semudah nya biar yg diajak bicara paham,pak purbaya ini menjelaskan dengan bahasa awam dicari semudah nya biar yang diajak bicara paham,1,0,0,Pak purbaya ini menjelaskan dg bahasa awam dicari semudah nya biar yg diajak bicara paham
1971772191688872448,Sat Sep 27 03:01:38 +0000 2025,Menkeu Purbaya: Rupiah Bakal Balik Menguat [ Sabtu Buzz #Astakom #GenZTakeAway ] https://t.co/QKXIu03h1K,menkeu purbaya rupiah bakal balik menguat sabtu buzz,0,0,0,Menkeu Purbaya: Rupiah Bakal Balik Menguat [ Sabtu Buzz   ] https://t.co/QKXIu03h1K
1971769551940722828,Sat Sep 27 02:51:09 +0000 2025,Pak menteri keuangan purbaya yudhi sudewo .#menteri #kemenkeu #purbayayudhisudewo #purbaya #illustration https://t.co/Mk12zTIAbx,pak menteri keuangan purbaya yudhi sudewo,1,0,0,Pak menteri keuangan purbaya yudhi sudewo .     https://t.co/Mk12zTIAbx
1971768569353445729,Sat Sep 27 02:47:15 +0000 2025, Video Baru: RISIKO BESAR MENKEU PURBAYA https://t.co/yTFP6oUGi9,video baru risiko besar menkeu purbaya,0,0,0,Video Baru: RISIKO BESAR MENKEU PURBAYA https://t.co/yTFP6oUGi9
1971768564312166843,Sat Sep 27 02:47:14 +0000 2025,@sxsxnineeight kita semua harus beri ruang ketidakpercayaan pada siapapun politisi termasuk Purbaya itu sendiri jgn kemakan tingkah koboinya kalo rupiah gak turun dari 17rb dan UMR daerah meningkat.,kita semua harus beri ruang ketidakpercayaan pada siapapun politisi termasuk purbaya itu sendiri jangan kemakan tingkah koboinya kalau rupiah tidak turun dari dan umr daerah meningkat,0,1,0,@sxsxnineeight kita semua harus beri ruang ketidakpercayaan pada siapapun politisi termasuk Purbaya itu sendiri jgn kemakan tingkah koboinya kalo rupiah gak turun dari 17rb dan UMR daerah meningkat.
1971767954737143842,Sat Sep 27 02:44:48 +0000 2025,Kementerian Keuangan berencana membuat program khusus berupa kawasan industri hasil tembakau IHT bagi produsen-produsen rokok ilegal agar dapat berproduksi secara resmi. Menteri Keuangan Purbaya Yudha Sadewa mengungkapkan Kawasan industri itu akan mencakup fasilitas gudang ,kementerian keuangan berencana membuat program khusus berupa kawasan industri hasil tembakau iht bagi produsenprodusen rokok ilegal agar dapat berproduksi secara resmi menteri keuangan purbaya yudha sadewa mengungkapkan kawasan industri itu akan mencakup fasilitas gudang,0,0,0,Kementerian Keuangan berencana membuat program khusus berupa kawasan industri hasil tembakau IHT bagi produsen-produsen rokok ilegal agar dapat berproduksi secara resmi. Menteri Keuangan Purbaya Yudha Sadewa mengungkapkan Kawasan industri itu akan mencakup fasilitas gudang
