id_str,created_at,full_text,normalized_text,favorite_count,reply_count,retweet_count,full_text_no_hashtag
1977293310051090836,Sun Oct 12 08:40:36 +0000 2025,HALA MIN BKN HANYA MRK..SM SJ..APA ADA 1 YG BS DIACUNGI JEMPOL DR MAKAN GRATIS DAN MSH BYK LAINYA MENTRI MENTRINYA...YG LGI KEREN PURBAYA..KITA LHT SEJAU MN PURBAYA DIPEMERINTAAN APAKA BNR SPRTI UCPANYA ATAU HANYA OMON DOANK. KITA LHT SEJAU MANA PURBAYA DAN PERSIDEN NYA,hala min bkn hanya mrksm sjapa ada yang diacungi jempol dari makan gratis dan msh byk lainya mentri mentrinyayg lgi bagus purbayakita lht sejau purbaya dipemerintaan apaka bnr spi ucpanya atau hanya omon doank kita lht sejau mana purbaya dan persiden nya,0,0,0,HALA MIN BKN HANYA MRK..SM SJ..APA ADA 1 YG BS DIACUNGI JEMPOL DR MAKAN GRATIS DAN MSH BYK LAINYA MENTRI MENTRINYA...YG LGI KEREN PURBAYA..KITA LHT SEJAU MN PURBAYA DIPEMERINTAAN APAKA BNR SPRTI UCPANYA ATAU HANYA OMON DOANK. KITA LHT SEJAU MANA PURBAYA DAN PERSIDEN NYA
1977292909209960547,Sun Oct 12 08:39:00 +0000 2025,Aseek ini kalo lihat direktur bea cukainya yang asal TNI misal turut melempem ya pecat juga dong pak Sipil macam pak purbaya kebukti tegas kok ga harus dari TNI kan ? Hidup Sipil ! https://t.co/DBPLcpxnVh,aseek ini kalau lihat direktur bea cukainya yang asal tni misal turut melempem pecat juga dong pak sipil macam pak purbaya kebukti tegas kok tidak harus dari tni kan hidup sipil,11,0,4,Aseek ini kalo lihat direktur bea cukainya yang asal TNI misal turut melempem ya pecat juga dong pak Sipil macam pak purbaya kebukti tegas kok ga harus dari TNI kan ? Hidup Sipil ! https://t.co/DBPLcpxnVh
1977290988780765626,Sun Oct 12 08:31:22 +0000 2025,@hansdavidian Baca komen2 jadul di sini sama komen2 sekarang ttg Purbaya jauh banget wkwk sekarang semua kubu lagi kepincut ama Purbaya.,baca komen jadul sini sama komen sekarang ttg purbaya jauh banget wkwk sekarang semua kubu lagi kepincut ama purbaya,0,0,0,@hansdavidian Baca komen2 jadul di sini sama komen2 sekarang ttg Purbaya jauh banget wkwk sekarang semua kubu lagi kepincut ama Purbaya.
1977290685318611334,Sun Oct 12 08:30:10 +0000 2025,gua kalo foto juga kaya purbaya,gua kalau foto juga kaya purbaya,0,0,0,gua kalo foto juga kaya purbaya
1977289764681531467,Sun Oct 12 08:26:30 +0000 2025,@satriohendri Sorry PSI ga dianggap.. dibenak tertanam nama2 yg dimusuhi mulyono diantara nya anies baswedan tom lembong said didu sudirman said mahfud dan skrg tambah idola baru .. purbaya.. PSI dan genk nya kelaut aja deh,sorry psi tidak dianggap dibenak teanam nama yang dimusuhi mulyono diantara nya anies baswedan tom lembong said didu sudirman said mahfud dan skrg tambah idola baru purbaya psi dan genk nya kelaut aja deh,1,0,0,@satriohendri Sorry PSI ga dianggap.. dibenak tertanam nama2 yg dimusuhi mulyono diantara nya anies baswedan tom lembong said didu sudirman said mahfud dan skrg tambah idola baru .. purbaya.. PSI dan genk nya kelaut aja deh
1977289628035301808,Sun Oct 12 08:25:58 +0000 2025,@tempodotco ApaÂ²an sih orang ini Purbaya belum menghasilkan dampak yang nyata di masyarakat udah disuruh jadi wapres aja terburu-buru sekali kalian?!,apaan sih orang ini purbaya belum menghasilkan dampak yang nyata masyarakat udah disuruh jadi wapres aja terburuburu sekali kalian,0,0,0,@tempodotco ApaÂ²an sih orang ini Purbaya belum menghasilkan dampak yang nyata di masyarakat udah disuruh jadi wapres aja terburu-buru sekali kalian?!
1977289128468529398,Sun Oct 12 08:23:59 +0000 2025,BGS PURBAYA KLU MAMPU DIACUNGI JMPOL RKYT.BLBI ANGGRAN BSR RKYTNYA GK TAU KERJANYA MRK APA..GK PERSIDEN GK MENTRI JGN BYK OMON DOANK BUKTIKAN DINEGARA DIDUNIA LG BERLOMBA NEPATKAN NEGARANYA BERWIBAWA DGN BAIK BGT NEPATKAN RKYTNYA DGN BAIK..BUKTIKAN JGN OMON DOANK,bgs purbaya klu mampu diacungi jmpol rkytblbi anggran bsr rkytnya tau kerjanya mrk apagk persiden mentri jangan byk omon doank buktikan dinegara didunia lagi berlomba nepatkan negaranya berwibawa dengan baik banget nepatkan rkytnya dengan baikbuktikan jangan omon doank,0,0,0,BGS PURBAYA KLU MAMPU DIACUNGI JMPOL RKYT.BLBI ANGGRAN BSR RKYTNYA GK TAU KERJANYA MRK APA..GK PERSIDEN GK MENTRI JGN BYK OMON DOANK BUKTIKAN DINEGARA DIDUNIA LG BERLOMBA NEPATKAN NEGARANYA BERWIBAWA DGN BAIK BGT NEPATKAN RKYTNYA DGN BAIK..BUKTIKAN JGN OMON DOANK
1977288456046100898,Sun Oct 12 08:21:18 +0000 2025,@satriohendri Saya yakin ada yg bisa kalahin trending nya Purbaya yaitu Mr. J tunjukin ijazahnya....,saya yakin ada yang bisa kalahin trending nya purbaya yaitu tunjukin ijazahnya,0,0,0,@satriohendri Saya yakin ada yg bisa kalahin trending nya Purbaya yaitu Mr. J tunjukin ijazahnya....
1977288125581083004,Sun Oct 12 08:20:00 +0000 2025,Energi positif Menkeu Purbaya pancarkan harapan bangsa dan negara: suara publik Jokowi hrs tanggung utang kereta api cepat Whoosh sbsr Rp 116 Triliun. Sdh diberitahu jalan terus. APBN dijadikan jaminan utk whoosh. KLIK YOUTUBE TONTON DAN SUBSCRIBE https://t.co/d76M4Zl08y,energi positif menkeu purbaya pancarkan harapan bangsa dan negara suara publik jokowi hrs tanggung utang kereta api cepat whoosh sbsr triliun sudah diberitahu jalan terus apbn dijadikan jaminan untuk whoosh klik youtube tonton dan subscribe,2,1,0,Energi positif Menkeu Purbaya pancarkan harapan bangsa dan negara: suara publik Jokowi hrs tanggung utang kereta api cepat Whoosh sbsr Rp 116 Triliun. Sdh diberitahu jalan terus. APBN dijadikan jaminan utk whoosh. KLIK YOUTUBE TONTON DAN SUBSCRIBE https://t.co/d76M4Zl08y
1977287090430935449,Sun Oct 12 08:15:53 +0000 2025,PURBAAYA HRS BUKTIKAN SLURU NEGERI BIAR PARPOL TAU..PURBAYA JGN OMON DOANK KUATERNYA NANTI DIAM DITEMPAT N OMON DOANK..PERSIDENYA SJ TDK BERKUTIK .MENGURUS NEGARANYA HANYA BGT BGY DOANK,purbaaya hrs buktikan sluru negeri biar parpol taupurbaya jangan omon doank kuaternya nanti diam ditempat omon doankpersidenya tidak berkutik mengurus negaranya hanya banget bgy doank,0,0,0,PURBAAYA HRS BUKTIKAN SLURU NEGERI BIAR PARPOL TAU..PURBAYA JGN OMON DOANK KUATERNYA NANTI DIAM DITEMPAT N OMON DOANK..PERSIDENYA SJ TDK BERKUTIK .MENGURUS NEGARANYA HANYA BGT BGY DOANK
1977286413566755127,Sun Oct 12 08:13:11 +0000 2025,Saat Purbaya Bahas Saham Gorengan &amp; Prediksi IHSG Bakal To The Moon! https://t.co/rmHDk9Dd4e https://t.co/M3SXwo8t43,saat purbaya bahas saham gorengan amp prediksi ihsg bakal the moon,0,0,0,Saat Purbaya Bahas Saham Gorengan &amp; Prediksi IHSG Bakal To The Moon! https://t.co/rmHDk9Dd4e https://t.co/M3SXwo8t43
1977286355299582271,Sun Oct 12 08:12:57 +0000 2025,Purbaya soal Satgas BLBI: Hasil Minim Mending Bubar https://t.co/2NGUMuFBFO via @InvestorID,purbaya soal satgas blbi hasil minim mending bubar via,0,0,0,Purbaya soal Satgas BLBI: Hasil Minim Mending Bubar https://t.co/2NGUMuFBFO via @InvestorID
1977285751525273932,Sun Oct 12 08:10:34 +0000 2025,@ILCTalkshow Rakyat Lebih baik punya pejabat kyak p.purbaya drpd pejabat jaim loyal nya tidak apa adanya.......drpd pejabat2 Termul,rakyat lebih baik punya pejabat kyak ppurbaya drpd pejabat jaim loyal nya tidak apa adanyadrpd pejabat termul,0,0,0,@ILCTalkshow Rakyat Lebih baik punya pejabat kyak p.purbaya drpd pejabat jaim loyal nya tidak apa adanya.......drpd pejabat2 Termul
1977285230945092033,Sun Oct 12 08:08:29 +0000 2025,@Opposisi6890 Pak Purbaya sekelas Komisaris... Kalau jeng bond sekelas SPG,pak purbaya sekelas komisaris kalau jeng bond sekelas spg,11,0,2,@Opposisi6890 Pak Purbaya sekelas Komisaris... Kalau jeng bond sekelas SPG
1977284817176907898,Sun Oct 12 08:06:51 +0000 2025,@kompascom Sekitar 50 trilyun para konglomerat nunggak pajak tapi bukannya dikejar malah yg ditekan kalangan rakyat kecil. Pengemplang pajak yg gede2 diajak damai. Makanya syukur mereka pada dipecat itu para pejabat pajak oleh Purbaya.,sekitar trilyun para konglomerat nunggak pajak tapi bukannya dikejar malah yang ditekan kalangan rakyat kecil pengemplang pajak yang gede diajak damai makanya syukur mereka pada dipecat itu para pejabat pajak oleh purbaya,0,0,0,@kompascom Sekitar 50 trilyun para konglomerat nunggak pajak tapi bukannya dikejar malah yg ditekan kalangan rakyat kecil. Pengemplang pajak yg gede2 diajak damai. Makanya syukur mereka pada dipecat itu para pejabat pajak oleh Purbaya.
1977284233304719839,Sun Oct 12 08:04:32 +0000 2025,@AliSafi_i @sharpandshark Banyak org seperti purbaya. Cuman disingkirkan oleh orang2an seperti luhut sm jkw,banyak orang sepei purbaya cuman disingkirkan oleh orangan sepei luhut sama jkw,0,0,0,@AliSafi_i @sharpandshark Banyak org seperti purbaya. Cuman disingkirkan oleh orang2an seperti luhut sm jkw
1977283378438455386,Sun Oct 12 08:01:08 +0000 2025,Menkeu Purbaya Tolak APBN Buat Bayar Utang Whoosh Simak Selengkapnya : https://t.co/amKjNn4kLW Baca artikel lainnya di : https://t.co/fH6UsGK7Aw #News #Most1058 #Pemerintah #Purbaya #APBN #Utang #Whoosh,menkeu purbaya tolak apbn buat bayar utang whoosh simak selengkapnya baca aikel lainnya,1,0,0,Menkeu Purbaya Tolak APBN Buat Bayar Utang Whoosh Simak Selengkapnya : https://t.co/amKjNn4kLW Baca artikel lainnya di : https://t.co/fH6UsGK7Aw
1977283326693216351,Sun Oct 12 08:00:55 +0000 2025,@DS_yantie Jika tunjuk oposisi gak mungkin Purbaya bisa jadi wapres.,jika tunjuk oposisi tidak mungkin purbaya bisa jadi wapres,0,0,0,@DS_yantie Jika tunjuk oposisi gak mungkin Purbaya bisa jadi wapres.
1977282252804641008,Sun Oct 12 07:56:39 +0000 2025,Melihat sepak terjang purbaya awal kerja jd inget hanip dakiri &amp; ET awal2 menjabat keras sidak sana sini tp cuma bbrapa bulan doang trs melempem kabar burungnya sih ada yg jewer kupingnya :D Yuk kita pantau purbaya kuat brpa bulan :) Tetep bu @susipudjiastuti msh diatas :),melihat sepak terjang purbaya awal kerja inget hanip dakiri amp awal menjabat keras sidak sana sini tapi cuma bbrapa bulan doang trs melempem kabar burungnya sih ada yang jewer kupingnya yuk kita pantau purbaya kuat brpa bulan tetep msh diatas,0,0,0,Melihat sepak terjang purbaya awal kerja jd inget hanip dakiri &amp; ET awal2 menjabat keras sidak sana sini tp cuma bbrapa bulan doang trs melempem kabar burungnya sih ada yg jewer kupingnya :D Yuk kita pantau purbaya kuat brpa bulan :) Tetep bu @susipudjiastuti msh diatas :)
1977281371212333358,Sun Oct 12 07:53:09 +0000 2025,@kegblgnunfaedh Saya tidak terima yang bahagiain rakyat tinggal pak Purbaya ,saya tidak terima yang bahagiain rakyat tinggal pak purbaya,0,0,0,@kegblgnunfaedh Saya tidak terima yang bahagiain rakyat tinggal pak Purbaya
1977281185295548416,Sun Oct 12 07:52:25 +0000 2025,Purbaya Soal Cawapres 2029: Baru Sebulan Kerja Gila Lu? https://t.co/Y3URDQ6Qbp https://t.co/CF41GAK9LA,purbaya soal cawapres baru sebulan kerja gila,0,0,0,Purbaya Soal Cawapres 2029: Baru Sebulan Kerja Gila Lu? https://t.co/Y3URDQ6Qbp https://t.co/CF41GAK9LA
1977281121068236974,Sun Oct 12 07:52:10 +0000 2025,@kiran_basroni @BiLLRaY2019 Bilangin sama pak Purbaya menkeu tdk mau bayar utang kereta cepat tapi bukan berarti negara tdk bayar krn akan dibayar oleh Danantara ya sama saja.,bilangin sama pak purbaya menkeu tidak mau bayar utang kereta cepat tapi bukan berai negara tidak bayar karena akan dibayar oleh danantara sama saja,0,0,0,@kiran_basroni @BiLLRaY2019 Bilangin sama pak Purbaya menkeu tdk mau bayar utang kereta cepat tapi bukan berarti negara tdk bayar krn akan dibayar oleh Danantara ya sama saja.
1977280397022208228,Sun Oct 12 07:49:17 +0000 2025,@Opposisi6890 Pak Purbaya...,pak purbaya,2,0,0,@Opposisi6890 Pak Purbaya...
1977279862789619856,Sun Oct 12 07:47:10 +0000 2025,Menteri Keuangan Purbaya Yudhi Sadewa percaya diri pertumbuhan ekonomi Indonesia bisa berangsur naik dari 5 12 persen menjadi lebih dari 5 5 persen. Bahkan menurut Menkeu Purbaya pertumbuhan ekonomi sebesar 7 persen tidak terlalu sulit untuk dicapai. Proyeksi itu ia https://t.co/ORdeIAtwxc,menteri keuangan purbaya yudhi sadewa percaya diri peumbuhan ekonomi indonesia bisa berangsur naik dari persen menjadi lebih dari persen bahkan menurut menkeu purbaya peumbuhan ekonomi sebesar persen tidak terlalu sulit untuk dicapai proyeksi itu,160,20,50,Menteri Keuangan Purbaya Yudhi Sadewa percaya diri pertumbuhan ekonomi Indonesia bisa berangsur naik dari 5 12 persen menjadi lebih dari 5 5 persen. Bahkan menurut Menkeu Purbaya pertumbuhan ekonomi sebesar 7 persen tidak terlalu sulit untuk dicapai. Proyeksi itu ia https://t.co/ORdeIAtwxc
1977279757848027479,Sun Oct 12 07:46:45 +0000 2025,Poling walaupun seumur jagung kinerja luar biasa saat ini. Purbaya Mulyani Mana lebih baik antara dua Anak bangsa ini??? https://t.co/1rA47H8KwW,poling walaupun seumur jagung kinerja luar biasa saat ini purbaya mulyani mana lebih baik antara dua anak bangsa ini,241,115,1424,Poling walaupun seumur jagung kinerja luar biasa saat ini. Purbaya Mulyani Mana lebih baik antara dua Anak bangsa ini??? https://t.co/1rA47H8KwW
1977279488850641319,Sun Oct 12 07:45:40 +0000 2025,Kl purbaya ini kinerjanya sesuai dengan celetukannya gue percaya sama teori konspirasi anaknya. Wkwk,purbaya ini kinerjanya sesuai dengan celetukannya gue percaya sama teori konspirasi anaknya wkwk,0,0,0,Kl purbaya ini kinerjanya sesuai dengan celetukannya gue percaya sama teori konspirasi anaknya. Wkwk
1977279468868964654,Sun Oct 12 07:45:36 +0000 2025,BUKTIKAN BPK PURBAYA .! .BUKTIKAN ! PAKSA SI JOKOPKI JAHANAAAAM YG BAYAR KERETA CEPAT . JOKOPKI DAN KELUARGA NYA FENIFUUUU ULUUUNG ! ,buktikan bpk purbaya buktikan paksa jokopki jahanaam yang bayar kereta cepat jokopki dan keluarga nya fenifuu uluung,1,0,0,BUKTIKAN BPK PURBAYA .! .BUKTIKAN ! PAKSA SI JOKOPKI JAHANAAAAM YG BAYAR KERETA CEPAT . JOKOPKI DAN KELUARGA NYA FENIFUUUU ULUUUNG !
1977278406791512276,Sun Oct 12 07:41:22 +0000 2025,Super Sekali Pak Menteri Keuangan Purbaya.. https://t.co/TpVA26QZVL,super sekali pak menteri keuangan purbaya,0,0,0,Super Sekali Pak Menteri Keuangan Purbaya.. https://t.co/TpVA26QZVL
1977277972601356628,Sun Oct 12 07:39:39 +0000 2025,@susno2g Artinya GEBRAKAN beliau di halurnya . M ada yg k bakaran jenggotan coba tanya RG belau setuju ga sama Pak Purbaya?,ainya gebrakan beliau halurnya ada yang bakaran jenggotan coba tanya belau setuju tidak sama pak purbaya,0,0,0,@susno2g Artinya GEBRAKAN beliau di halurnya . M ada yg k bakaran jenggotan coba tanya RG belau setuju ga sama Pak Purbaya?
1977277951428509800,Sun Oct 12 07:39:34 +0000 2025,@abu_waras Saran sy sebelum maju cawapres Menteri Purbaya harus pastikan dulu ijazahnya masih asli dan masih ada tersimpan agar tidak repot jika diminta KPU untuk menunjukannya...,saran saya sebelum maju cawapres menteri purbaya harus pastikan dulu ijazahnya masih asli dan masih ada tersimpan agar tidak repot jika diminta kpu untuk menunjukannya,0,0,0,@abu_waras Saran sy sebelum maju cawapres Menteri Purbaya harus pastikan dulu ijazahnya masih asli dan masih ada tersimpan agar tidak repot jika diminta KPU untuk menunjukannya...
1977271426114896353,Sun Oct 12 07:13:38 +0000 2025,@tvOneNews Kalo rakyat akal sehat. Pasti mendukung Pak. Purbaya. ,kalau rakyat akal sehat pasti mendukung pak purbaya,0,0,0,@tvOneNews Kalo rakyat akal sehat. Pasti mendukung Pak. Purbaya.
1977270724466557420,Sun Oct 12 07:10:51 +0000 2025,Menkeu Purbaya Tak Gentar Hadapi Luhut Hingga Bahlil https://t.co/SyFKRwWeny,menkeu purbaya tak gentar hadapi luhut hingga bahlil,4,1,1,Menkeu Purbaya Tak Gentar Hadapi Luhut Hingga Bahlil https://t.co/SyFKRwWeny
1977269812343804092,Sun Oct 12 07:07:13 +0000 2025,BENAR PAK PURBAYA SURUH AJA SI JOKOWI YANG BAYAR... ENAK AJA DIA YANG NGUTANG RAKYAT DISURUH BAYAR https://t.co/SGAU26dU4S,benar pak purbaya suruh aja jokowi yang bayar enak aja dia yang ngutang rakyat disuruh bayar,1,0,0,BENAR PAK PURBAYA SURUH AJA SI JOKOWI YANG BAYAR... ENAK AJA DIA YANG NGUTANG RAKYAT DISURUH BAYAR https://t.co/SGAU26dU4S
1977267835748631031,Sun Oct 12 06:59:22 +0000 2025,Purbaya pedes tapi progressif ya gmn menurut kalian?,purbaya pedes tapi progressif gmn menurut kalian,0,0,0,Purbaya pedes tapi progressif ya gmn menurut kalian?
1977267424920846789,Sun Oct 12 06:57:44 +0000 2025,@aganbejo @Dedy44169434 @rayestu Purbaya Yudhi Sadewa dalam presentasi humorris di Investor Daily Summit menyampaikan poin utama soal stabilitas ekonomi Indonesia di tengah gejolak global dengan fokus pada pengendalian APBN agar defisit di bawah 3% dan pertumbuhan 5-6%. Ia tekankan peluang investasi di,purbaya yudhi sadewa dalam presentasi humorris investor daily summit menyampaikan poin utama soal stabilitas ekonomi indonesia tengah gejolak global dengan fokus pada pengendalian apbn agar defisit bawah dan peumbuhan tekankan peluang investasi,0,0,0,@aganbejo @Dedy44169434 @rayestu Purbaya Yudhi Sadewa dalam presentasi humorris di Investor Daily Summit menyampaikan poin utama soal stabilitas ekonomi Indonesia di tengah gejolak global dengan fokus pada pengendalian APBN agar defisit di bawah 3% dan pertumbuhan 5-6%. Ia tekankan peluang investasi di
1977267222092660792,Sun Oct 12 06:56:56 +0000 2025,@Dedy44169434 @rayestu @grok bikin summary video stand up Purbaya apa saja point2xnya.,bikin summary video stand purbaya apa saja pointxnya,0,1,0,@Dedy44169434 @rayestu @grok bikin summary video stand up Purbaya apa saja point2xnya.
1977266965749415976,Sun Oct 12 06:55:55 +0000 2025,@ILCTalkshow SMI mengejar pertumbuhan tidak perduli itu hanya dari segelintir pelaku ekonomi besar. Purbaya mengejar pertumbuhan dan pemerataan pertumbuhan tsb. Ekonomi digerakkan dari mikro dan kecil kemudian naik ke menengah dan usaha besar. Dimulai dari konsumsi rumah tangga.,smi mengejar peumbuhan tidak perduli itu hanya dari segelintir pelaku ekonomi besar purbaya mengejar peumbuhan dan pemerataan peumbuhan tsb ekonomi digerakkan dari mikro dan kecil kemudian naik menengah dan usaha besar dimulai dari konsumsi rumah tangga,0,0,0,@ILCTalkshow SMI mengejar pertumbuhan tidak perduli itu hanya dari segelintir pelaku ekonomi besar. Purbaya mengejar pertumbuhan dan pemerataan pertumbuhan tsb. Ekonomi digerakkan dari mikro dan kecil kemudian naik ke menengah dan usaha besar. Dimulai dari konsumsi rumah tangga.
1977266804151226527,Sun Oct 12 06:55:16 +0000 2025,@siregar_najeges very good advice tuh lae.... gak suka purbaya pindah k luar negri,very good advice tuh lae tidak suka purbaya pindah luar negri,2,0,0,@siregar_najeges very good advice tuh lae.... gak suka purbaya pindah k luar negri
1977266692993794375,Sun Oct 12 06:54:50 +0000 2025,@hamtawindu @msaid_didu Memang mentri selain Purbaya pd tdk waras? Tobat dah ...,memang mentri selain purbaya tidak waras tobat dah,0,0,0,@hamtawindu @msaid_didu Memang mentri selain Purbaya pd tdk waras? Tobat dah ...
1977266102301605927,Sun Oct 12 06:52:29 +0000 2025,Purbaya Setuju Kucuran Dana Rp200 T ke Himbara untuk Sektor Otomotif https://t.co/zHXYqNIAM4,purbaya setuju kucuran dana himbara untuk sektor otomotif,99,13,23,Purbaya Setuju Kucuran Dana Rp200 T ke Himbara untuk Sektor Otomotif https://t.co/zHXYqNIAM4
1977265477362786453,Sun Oct 12 06:50:00 +0000 2025,Menteri Keuangan Purbaya Yudhi Sadewa memprediksi ekonomi Indonesia akan tumbuh lebih pesat daripada tahun 2025. Ia juga mengungkapkan angka pertumbuhan ekonomi akan melesat di angka 6%. Menkeu Purbaya menyebutkan prediksi pertumbuhan ekonomi ini juga didorong dengan kebijakan https://t.co/aWRwYh2zAO,menteri keuangan purbaya yudhi sadewa memprediksi ekonomi indonesia akan tumbuh lebih pesat daripada tahun juga mengungkapkan angka peumbuhan ekonomi akan melesat angka menkeu purbaya menyebutkan prediksi peumbuhan ekonomi ini juga didorong dengan kebijakan,5,2,1,Menteri Keuangan Purbaya Yudhi Sadewa memprediksi ekonomi Indonesia akan tumbuh lebih pesat daripada tahun 2025. Ia juga mengungkapkan angka pertumbuhan ekonomi akan melesat di angka 6%. Menkeu Purbaya menyebutkan prediksi pertumbuhan ekonomi ini juga didorong dengan kebijakan https://t.co/aWRwYh2zAO
1977264956296118446,Sun Oct 12 06:47:56 +0000 2025,Gue cuma demen purbaya tuh berani nyerang sesama pejabat doang sih. Sistemnya dia selama ini belom tampak hasilnya jadi gabisa gue puji soal itu.,gue cuma demen purbaya tuh berani nyerang sesama pejabat doang sih sistemnya dia selama ini belom tampak hasilnya jadi gabisa gue puji soal itu,0,0,0,Gue cuma demen purbaya tuh berani nyerang sesama pejabat doang sih. Sistemnya dia selama ini belom tampak hasilnya jadi gabisa gue puji soal itu.
1977264435883569250,Sun Oct 12 06:45:51 +0000 2025,@tempodotco Di era pejabat kayak erick tohir dan bahlil masih ada orang seperti purbaya. Purbaya for life ,era pejabat kayak erick tohir dan bahlil masih ada orang sepei purbaya purbaya for life,0,0,0,@tempodotco Di era pejabat kayak erick tohir dan bahlil masih ada orang seperti purbaya. Purbaya for life
1977263589737296350,Sun Oct 12 06:42:30 +0000 2025,Buah dari Proyek Ugal Ugalan Jokowi dan Kroninya. Merugi. Ditagih ke APBN. Enak aja. Pak Purbaya ogah bayar. SETUJU PAK. https://t.co/VrMkJ8FgaF,buah dari proyek ugal ugalan jokowi dan kroninya merugi ditagih apbn enak aja pak purbaya ogah bayar setuju pak,9,0,3,Buah dari Proyek Ugal Ugalan Jokowi dan Kroninya. Merugi. Ditagih ke APBN. Enak aja. Pak Purbaya ogah bayar. SETUJU PAK. https://t.co/VrMkJ8FgaF
1977263118050115910,Sun Oct 12 06:40:37 +0000 2025,@Nathanaels1611 @ZoneVenomWar Ya emang. Jawa ituu mah dia heheheh. Sama ae kek Budi Gunadi Sadikin juga orang Bogor Kota. Bangkenya sama2 anak ITB lagi. Mana sama2 alumni Recis n bapaknya BGS itu pejabat di Kebun Raya Bogor (dulu masih LIPI) bapaknya Purbaya kan dosen ITB. BGS Sunda Garut PYS Purworejo,emang jawa ituu mah dia heheheh sama kek budi gunadi sadikin juga orang bogor kota bangkenya sama anak itb lagi mana sama alumni recis bapaknya bgs itu pejabat kebun raya bogor dulu masih lipi bapaknya purbaya kan dosen itb bgs sunda garut pys purworejo,9,2,2,@Nathanaels1611 @ZoneVenomWar Ya emang. Jawa ituu mah dia heheheh. Sama ae kek Budi Gunadi Sadikin juga orang Bogor Kota. Bangkenya sama2 anak ITB lagi. Mana sama2 alumni Recis n bapaknya BGS itu pejabat di Kebun Raya Bogor (dulu masih LIPI) bapaknya Purbaya kan dosen ITB. BGS Sunda Garut PYS Purworejo
1977261729441890644,Sun Oct 12 06:35:06 +0000 2025,@AirinDatangLagi @triewahyu38 Kalo ekonomi Indonesia mau membaik harus kita dukung kebijakan pak Purbaya termasuk tolak bayar hutang whoosh ini,kalau ekonomi indonesia mau membaik harus kita dukung kebijakan pak purbaya termasuk tolak bayar hutang whoosh ini,1,0,0,@AirinDatangLagi @triewahyu38 Kalo ekonomi Indonesia mau membaik harus kita dukung kebijakan pak Purbaya termasuk tolak bayar hutang whoosh ini
1977260881420689670,Sun Oct 12 06:31:44 +0000 2025,@AnKiiim_ @PurbayaYudhi @FerdinandHaean3 Lo bacot doang @FerdinandHaean3 kerja lo mana? Purbaya sebulan kerja dah ada tuh kliatan pake belaga disamain jokowi bukannya hasil kerja lu ama partai lu tuh 10 taon ampe tuh bangsat ancurin negeri bangke,bacot doang kerja mana purbaya sebulan kerja dah ada tuh kliatan pake belaga disamain jokowi bukannya hasil kerja ama paai tuh taon ampe tuh bangsat ancurin negeri bangke,0,0,0,@AnKiiim_ @PurbayaYudhi @FerdinandHaean3 Lo bacot doang @FerdinandHaean3 kerja lo mana? Purbaya sebulan kerja dah ada tuh kliatan pake belaga disamain jokowi bukannya hasil kerja lu ama partai lu tuh 10 taon ampe tuh bangsat ancurin negeri bangke
1977259978886193602,Sun Oct 12 06:28:09 +0000 2025,MENKEU PURBAYA DORONG PENINGKATAN LIKUIDITAS DAN INVESTASI AGAR EKONOMI TUMBUH LEBIH KUAT https://t.co/f5jQ7KUdXk,menkeu purbaya dorong peningkatan likuiditas dan investasi agar ekonomi tumbuh lebih kuat,0,0,0,MENKEU PURBAYA DORONG PENINGKATAN LIKUIDITAS DAN INVESTASI AGAR EKONOMI TUMBUH LEBIH KUAT https://t.co/f5jQ7KUdXk
1977259874745786831,Sun Oct 12 06:27:44 +0000 2025,Sosok Mr J PSI Kalah Tenar dari Purbaya https://t.co/CerRd3T4Qn,sosok psi kalah tenar dari purbaya,0,0,0,Sosok Mr J PSI Kalah Tenar dari Purbaya https://t.co/CerRd3T4Qn
1977259851572302211,Sun Oct 12 06:27:38 +0000 2025,@BiLLRaY2019 Suruh Jokowi bayar hutang dan bunga hutangnya om Purbaya. Tuman !!! ,suruh jokowi bayar hutang dan bunga hutangnya purbaya tuman,0,0,0,@BiLLRaY2019 Suruh Jokowi bayar hutang dan bunga hutangnya om Purbaya. Tuman !!!
1977259783976804533,Sun Oct 12 06:27:22 +0000 2025,SIKAT DONG..! Begini Tanggapan Dirut BEI Saat Purbaya Soroti Gorengan Pasar Saham https://t.co/h98gcOeSY3 lewat @BERGELORA.COM https://t.co/VUI003g6Cd,sikat dong begini tanggapan dirut bei saat purbaya soroti gorengan pasar saham lewat com,0,0,0,SIKAT DONG..! Begini Tanggapan Dirut BEI Saat Purbaya Soroti Gorengan Pasar Saham https://t.co/h98gcOeSY3 lewat @BERGELORA.COM https://t.co/VUI003g6Cd
1977259682231382479,Sun Oct 12 06:26:58 +0000 2025,@ILCTalkshow Prof ini analisa tajam tp msh textbook tdk comprehensive. Purbaya Ekonom Technocratics. Ekonomi dianggap fungsi dg bnyk variabel dipilih vrbl yg dominan. Dia minimalisir vrbl yg merugikan (fungsi dalam fungsi). Dia pilih juga skala prioritas algorithmic kontinjensi &amp; sitematis,prof ini analisa tajam tapi msh textbook tidak comprehensive purbaya ekonom technocratics ekonomi dianggap fungsi dengan bnyk variabel dipilih vrbl yang dominan dia minimalisir vrbl yang merugikan fungsi dalam fungsi dia pilih juga skala prioritas algorithmic kontinjensi amp sitematis,2,2,1,@ILCTalkshow Prof ini analisa tajam tp msh textbook tdk comprehensive. Purbaya Ekonom Technocratics. Ekonomi dianggap fungsi dg bnyk variabel dipilih vrbl yg dominan. Dia minimalisir vrbl yg merugikan (fungsi dalam fungsi). Dia pilih juga skala prioritas algorithmic kontinjensi &amp; sitematis
