id_str,created_at,full_text,normalized_text,favorite_count,reply_count,retweet_count,full_text_no_hashtag
1972670576981332091,Mon Sep 29 14:31:30 +0000 2025,Menkeu Purbaya Yudhi Sadewa melakukan sidak ke kantor pusat BNI untuk mengecek penggunaan dana sisa anggaran Rp200 triliun yang ditempatkan di bank Himbara di mana BNI mendapat porsi Rp55 triliun. Ia menilai BNI telah menyalurkan dana dengan baik untuk kredit yang ditargetkan https://t.co/jxDzEXNlIV,menkeu purbaya yudhi sadewa melakukan sidak kantor pusat bni untuk mengecek penggunaan dana sisa anggaran triliun yang ditempatkan bank himbara mana bni mendapat porsi triliun menilai bni telah menyalurkan dana dengan baik untuk kredit yang ditargetkan,28,4,7,Menkeu Purbaya Yudhi Sadewa melakukan sidak ke kantor pusat BNI untuk mengecek penggunaan dana sisa anggaran Rp200 triliun yang ditempatkan di bank Himbara di mana BNI mendapat porsi Rp55 triliun. Ia menilai BNI telah menyalurkan dana dengan baik untuk kredit yang ditargetkan https://t.co/jxDzEXNlIV
1972668382110433779,Mon Sep 29 14:22:47 +0000 2025,@Franken_blues Bukannya purbaya ini diduga kader PDIP?,bukannya purbaya ini diduga kader pdip,1,1,0,@Franken_blues Bukannya purbaya ini diduga kader PDIP?
1972662975375769967,Mon Sep 29 14:01:18 +0000 2025,Berikut adalah capture dari salary crediting (Gaji guru TPG sertifikasi) . katanya bagi penghasilan yg dibawah 10 juta mau dibebaskan dari pajak penghasilan. Koq masih tetap di potong ya gimana ini bapak menteri Purbaya ? https://t.co/NgiBmB4yXO,berikut adalah capture dari salary crediting gaji guru tpg seifikasi katanya bagi penghasilan yang dibawah juta mau dibebaskan dari pajak penghasilan koq masih tetap potong gimana ini bapak menteri purbaya,0,1,0,Berikut adalah capture dari salary crediting (Gaji guru TPG sertifikasi) . katanya bagi penghasilan yg dibawah 10 juta mau dibebaskan dari pajak penghasilan. Koq masih tetap di potong ya gimana ini bapak menteri Purbaya ? https://t.co/NgiBmB4yXO
1972662656499581170,Mon Sep 29 14:00:02 +0000 2025,Menteri Keuangan (Menkeu) Purbaya Yudhi Sadewa melakukan inspeksi mendadak ke salah satu kantor pusat bank pemerintah pada Senin pagi. Kunjungan mendadak ini bertujuan untuk memantau langsung kinerja bank milik negara tersebut. Menkeu Purbaya tiba di kantor pusat bank pemerintah https://t.co/2eUzYkfBon,menteri keuangan menkeu purbaya yudhi sadewa melakukan inspeksi mendadak salah satu kantor pusat bank pemerintah pada senin pagi kunjungan mendadak ini beujuan untuk memantau langsung kinerja bank milik negara tersebut menkeu purbaya tiba kantor pusat bank pemerintah,11,4,1,Menteri Keuangan (Menkeu) Purbaya Yudhi Sadewa melakukan inspeksi mendadak ke salah satu kantor pusat bank pemerintah pada Senin pagi. Kunjungan mendadak ini bertujuan untuk memantau langsung kinerja bank milik negara tersebut. Menkeu Purbaya tiba di kantor pusat bank pemerintah https://t.co/2eUzYkfBon
1972660641438572822,Mon Sep 29 13:52:01 +0000 2025,Prabowo Terkesan Purbaya-AHY Lulusan S3: Kalau Enggak Bisa Perbaiki Sistem Kelewatan! https://t.co/XoMOSabxnV,prabowo terkesan purbayaahy lulusan kalau enggak bisa perbaiki sistem kelewatan,83,70,17,Prabowo Terkesan Purbaya-AHY Lulusan S3: Kalau Enggak Bisa Perbaiki Sistem Kelewatan! https://t.co/XoMOSabxnV
1972658904682353018,Mon Sep 29 13:45:07 +0000 2025,@profesor_saham prof masa pas kunjungan berkedok sidak ke bbni tadi lord purbaya godain bu Xandra ckck,prof masa pas kunjungan berkedok sidak bbni tadi lord purbaya godain xandra ckck,27,2,1,@profesor_saham prof masa pas kunjungan berkedok sidak ke bbni tadi lord purbaya godain bu Xandra ckck
1972657866818417142,Mon Sep 29 13:41:00 +0000 2025,Klaim 10.000 saldo pas download apk Shopeepay caranya: Upgrade ke Shopeepay plus log in pake akun shopee &amp; masukin kode referral FF6JWV5WP diskon promo info freelance job receh zonauang menpora erick thohir bahlil prabowo jokowi purbaya megawati https://t.co/cziHHCFI5H https://t.co/YLZMg7cAC7,klaim saldo pas download apk shopeepay caranya upgrade shopeepay plus log pake akun shopee amp masukin kode referral ffjwvwp diskon promo info freelance job receh zonauang menpora erick thohir bahlil prabowo jokowi purbaya megawati,0,0,0,Klaim 10.000 saldo pas download apk Shopeepay caranya: Upgrade ke Shopeepay plus log in pake akun shopee &amp; masukin kode referral FF6JWV5WP diskon promo info freelance job receh zonauang menpora erick thohir bahlil prabowo jokowi purbaya megawati https://t.co/cziHHCFI5H https://t.co/YLZMg7cAC7
1972654508204499019,Mon Sep 29 13:27:39 +0000 2025,Menkeu Purbaya sowan ke mantan Presiden Jokowi sinyal bahwa ekonomi era Prabowo butuh legitimasi publik. Dukungan figur senior menciptakan stabilitas dan kepercayaan modal yg tak bisa diukur dengan grafik apapun https://t.co/liwkh43xB3,menkeu purbaya sowan mantan presiden jokowi sinyal bahwa ekonomi era prabowo butuh legitimasi publik dukungan figur senior menciptakan stabilitas dan kepercayaan modal yang tak bisa diukur dengan grafik apapun,3,0,0,Menkeu Purbaya sowan ke mantan Presiden Jokowi sinyal bahwa ekonomi era Prabowo butuh legitimasi publik. Dukungan figur senior menciptakan stabilitas dan kepercayaan modal yg tak bisa diukur dengan grafik apapun https://t.co/liwkh43xB3
1972653982679236950,Mon Sep 29 13:25:34 +0000 2025,Menteri Keuangan Purbaya Yudhi Sadewa memastikan cukai rokok tidak naik 2026 dukung pemulihan industri rokok. https://t.co/TjZZR7rLWT,menteri keuangan purbaya yudhi sadewa memastikan cukai rokok tidak naik dukung pemulihan industri rokok,0,0,0,Menteri Keuangan Purbaya Yudhi Sadewa memastikan cukai rokok tidak naik 2026 dukung pemulihan industri rokok. https://t.co/TjZZR7rLWT
1972653698313834895,Mon Sep 29 13:24:26 +0000 2025,Awas! Kebijakan Cukai Rokok Purbaya Bisa Berubah Jadi Jebakan Fiskal #MenkeuPurbaya #IndustriRokok https://t.co/wUndjVkTAt,awas kebijakan cukai rokok purbaya bisa berubah jadi jebakan fiskal,0,0,0,Awas! Kebijakan Cukai Rokok Purbaya Bisa Berubah Jadi Jebakan Fiskal   https://t.co/wUndjVkTAt
1972653669872177634,Mon Sep 29 13:24:19 +0000 2025,Menkeu Purbaya lagi nge-push Pak Jokowi buat kasih 'approval' biar ekonomi kita makin 'cair'. Semoga 'supply chain' lancar inflasi bisa 'dikondisikan' dan 'growth' kita makin 'gaspol' deh! Bumi #MemberiYangTerbaik https://t.co/YcLawrQD95,menkeu purbaya lagi ngepush pak jokowi buat kasih approval biar ekonomi kita makin cair semoga supply chain lancar inflasi bisa dikondisikan dan growth kita makin gaspol deh bumi,2,0,1,Menkeu Purbaya lagi nge-push Pak Jokowi buat kasih 'approval' biar ekonomi kita makin 'cair'. Semoga 'supply chain' lancar inflasi bisa 'dikondisikan' dan 'growth' kita makin 'gaspol' deh! Bumi  https://t.co/YcLawrQD95
1972652223730794993,Mon Sep 29 13:18:34 +0000 2025,super kocak mimpi ke dokter gigi dan gongs nya lagi dokter giginya mentri keuangan indonesia saat ini bapak purbaya,super kocak mimpi dokter gigi dan gongs nya lagi dokter giginya mentri keuangan indonesia saat ini bapak purbaya,0,0,0,super kocak mimpi ke dokter gigi dan gongs nya lagi dokter giginya mentri keuangan indonesia saat ini bapak purbaya
1972650599247426037,Mon Sep 29 13:12:07 +0000 2025,Gilak emng lord purbaya ni mirip bu susi sat set,gilak emng lord purbaya mirip susi sat set,0,0,0,Gilak emng lord purbaya ni mirip bu susi sat set
1972643839543586837,Mon Sep 29 12:45:15 +0000 2025,@ardi_tama1 Bisa dikurangi Dulu krn bowo g yakin dgn SM. Jurusnya paling2 naikin pajak realokasi anggaran klo kepepet baru utang Bowo bilang rasio hutang masih konservatif Akhirnya dia mau naikin ratio pajak. Jelas butuh lebih banyak orang Tpi klo jurus purbaya sukses g butuh banyak orang,bisa dikurangi dulu karena bowo yakin dengan sama jurusnya paling naikin pajak realokasi anggaran kalau kepepet baru utang bowo bilang rasio hutang masih konservatif akhirnya dia mau naikin ratio pajak jelas butuh lebih banyak orang tpi kalau jurus purbaya sukses butuh banyak orang,1,0,0,@ardi_tama1 Bisa dikurangi Dulu krn bowo g yakin dgn SM. Jurusnya paling2 naikin pajak realokasi anggaran klo kepepet baru utang Bowo bilang rasio hutang masih konservatif Akhirnya dia mau naikin ratio pajak. Jelas butuh lebih banyak orang Tpi klo jurus purbaya sukses g butuh banyak orang
1972642661149594041,Mon Sep 29 12:40:35 +0000 2025,Heboh! Anak Menkeu Purbaya Sadewa Pamer Gepokan Dolar AS dan Hasil Trading Miliaran di TikTok! Nggak boleh? https://t.co/NDU4go6vjO,heboh anak menkeu purbaya sadewa pamer gepokan dolar dan hasil trading miliaran tiktok tidak boleh,0,0,0,Heboh! Anak Menkeu Purbaya Sadewa Pamer Gepokan Dolar AS dan Hasil Trading Miliaran di TikTok! Nggak boleh? https://t.co/NDU4go6vjO
1972642173603684478,Mon Sep 29 12:38:38 +0000 2025,Bung @aniesbaswedan jebolan S3 jugak! Apa daya QC survey Qodari 58% &amp; KPU bikin 02 pemenangnya @prabowo-Gibran yg S3nya SD SMP SMA penyetaraan yg menang Pilpres. Amit2 jabang Prabowo Colek AHY hingga Purbaya: S-3 Kalau Tak Bisa Perbaiki Sistem Kelewatan https://t.co/Jjck4RZPUZ,bung jebolan jugak apa daya survey qodari amp kpu bikin pemenangnya gibran yang snya smp sma penyetaraan yang menang pilpres amit jabang prabowo colek ahy hingga purbaya kalau tak bisa perbaiki sistem kelewatan,0,0,0,Bung @aniesbaswedan jebolan S3 jugak! Apa daya QC survey Qodari 58% &amp; KPU bikin 02 pemenangnya @prabowo-Gibran yg S3nya SD SMP SMA penyetaraan yg menang Pilpres. Amit2 jabang Prabowo Colek AHY hingga Purbaya: S-3 Kalau Tak Bisa Perbaiki Sistem Kelewatan https://t.co/Jjck4RZPUZ
1972640250997461340,Mon Sep 29 12:31:00 +0000 2025,Rp. 10.000 saldo dpt pas download apk shopeepay banyak promo Caranya: Upgrade ke spay plus login dg akun shopee &amp; masukin kode referral FF6JWV5WP diskon info freelance job receh zonauang menpora erick thohir bahlil prabowo jokowi purbaya indra sjafri https://t.co/jrJWpyIjPR https://t.co/XbWT7e912e,saldo dpt pas download apk shopeepay banyak promo caranya upgrade spay plus login dengan akun shopee amp masukin kode referral ffjwvwp diskon info freelance job receh zonauang menpora erick thohir bahlil prabowo jokowi purbaya indra sjafri,0,0,0,Rp. 10.000 saldo dpt pas download apk shopeepay banyak promo Caranya: Upgrade ke spay plus login dg akun shopee &amp; masukin kode referral FF6JWV5WP diskon info freelance job receh zonauang menpora erick thohir bahlil prabowo jokowi purbaya indra sjafri https://t.co/jrJWpyIjPR https://t.co/XbWT7e912e
1972640075482816794,Mon Sep 29 12:30:18 +0000 2025,ULTIMATUM Menkeu Purbaya Berantas Peredaran Rokok Ilegal hingga Perketat Bea Cukai https://t.co/oDwl7gt8dc lewat @tribunnews,ultimatum menkeu purbaya berantas peredaran rokok ilegal hingga perketat bea cukai lewat,0,0,0,ULTIMATUM Menkeu Purbaya Berantas Peredaran Rokok Ilegal hingga Perketat Bea Cukai https://t.co/oDwl7gt8dc lewat @tribunnews
1972639768803696983,Mon Sep 29 12:29:05 +0000 2025,@biantoro_robin @jackcfrost ANJINK TOLOL. Dia 17thn jadi Menteri Keuangan dan ga ada 1 pun EKONOM berani ANALISA sistem keuangannya krn dia pake TEORI MONETER REAL. Noh Purbaya baru naik2 lgsg dimaki-maki sama semua EKONOM dibilang Jangan sampe GAGAL . Krn dia pake MONETER HIGH RISK alias teori murahan.,anjink tolol dia thn jadi menteri keuangan dan tidak ada pun ekonom berani analisa sistem keuangannya karena dia pake teori moneter real noh purbaya baru naik lgsg dimakimaki sama semua ekonom dibilang jangan sampe gagal karena dia pake moneter high risk alias teori murahan,1,2,0,@biantoro_robin @jackcfrost ANJINK TOLOL. Dia 17thn jadi Menteri Keuangan dan ga ada 1 pun EKONOM berani ANALISA sistem keuangannya krn dia pake TEORI MONETER REAL. Noh Purbaya baru naik2 lgsg dimaki-maki sama semua EKONOM dibilang Jangan sampe GAGAL . Krn dia pake MONETER HIGH RISK alias teori murahan.
1972639253713891531,Mon Sep 29 12:27:02 +0000 2025,Menkeu Purbaya sowan ke Jokowi bukan sekadar formalitas melainkan sinyal bahwa ekonomi tak hanya soal angka dan regulasi tapi juga soal legitimasi kepemimpinan karena dalam politik-ekonomi restu berarti stabilitas stabilitas melahirkan kepercayaan dan kepercayaan itulah https://t.co/qsDCnlU8Ge,menkeu purbaya sowan jokowi bukan sekadar formalitas melainkan sinyal bahwa ekonomi tak hanya soal angka dan regulasi tapi juga soal legitimasi kepemimpinan karena dalam politikekonomi restu berai stabilitas stabilitas melahirkan kepercayaan dan kepercayaan itulah,121,7,24,Menkeu Purbaya sowan ke Jokowi bukan sekadar formalitas melainkan sinyal bahwa ekonomi tak hanya soal angka dan regulasi tapi juga soal legitimasi kepemimpinan karena dalam politik-ekonomi restu berarti stabilitas stabilitas melahirkan kepercayaan dan kepercayaan itulah https://t.co/qsDCnlU8Ge
1972636256510374359,Mon Sep 29 12:15:08 +0000 2025,Purbaya: Dari Rp 71 T Anggaran MBG Baru Rp13 T yang terserap Rp 58 T Hilang dalam Birokrasi . . Mana yg lebih jahatâ€¼ï¸ Siapa yg penjahat â€¼ï¸ https://t.co/doLQyV11iK,purbaya dari anggaran mbg baru yang terserap hilang dalam birokrasi mana yang lebih jahat siapa yang penjahat,3,2,0,Purbaya: Dari Rp 71 T Anggaran MBG Baru Rp13 T yang terserap Rp 58 T Hilang dalam Birokrasi . . Mana yg lebih jahatâ€¼ï¸ Siapa yg penjahat â€¼ï¸ https://t.co/doLQyV11iK
1972633578312962178,Mon Sep 29 12:04:29 +0000 2025,@sukamotipuyo &gt;Purbaya mau potong cukai rokok &gt;tren pamer rokok mulai viral something sounds suspicious https://t.co/Ku8l0dy5VY,gtpurbaya mau potong cukai rokok gttren pamer rokok mulai viral something sounds suspicious,20,0,0,@sukamotipuyo &gt;Purbaya mau potong cukai rokok &gt;tren pamer rokok mulai viral something sounds suspicious https://t.co/Ku8l0dy5VY
1972630183950819745,Mon Sep 29 11:51:00 +0000 2025,Bonus 10.000 saldo kalau install apk Shopeepay Caranya : Upgrade ke Spay plus log in pakai akun shopee &amp; masukkan kode referral FF6JWV5WP diskon promo info freelance job receh zonauang menpora erick thohir bahlil prabowo jokowi purbaya indra sjafri https://t.co/jrJWpyIRFp https://t.co/rBzzdFxOQF,bonus saldo kalau install apk shopeepay caranya upgrade spay plus log pakai akun shopee amp masukkan kode referral ffjwvwp diskon promo info freelance job receh zonauang menpora erick thohir bahlil prabowo jokowi purbaya indra sjafri,1,0,0,Bonus 10.000 saldo kalau install apk Shopeepay Caranya : Upgrade ke Spay plus log in pakai akun shopee &amp; masukkan kode referral FF6JWV5WP diskon promo info freelance job receh zonauang menpora erick thohir bahlil prabowo jokowi purbaya indra sjafri https://t.co/jrJWpyIRFp https://t.co/rBzzdFxOQF
1972628683459305866,Mon Sep 29 11:45:02 +0000 2025,Rp6 5 T Bansos Cair Oktober! Menkeu Purbaya janji Bansos beras 10 Kg &amp; Minyak cair ke 18 27 juta penerima pastikan fiskal sehat &amp; siap https://t.co/vgKSF84C2t,bansos cair oktober menkeu purbaya janji bansos beras amp minyak cair juta penerima pastikan fiskal sehat amp siap,0,0,0,Rp6 5 T Bansos Cair Oktober! Menkeu Purbaya janji Bansos beras 10 Kg &amp; Minyak cair ke 18 27 juta penerima pastikan fiskal sehat &amp; siap https://t.co/vgKSF84C2t
1972628138522968118,Mon Sep 29 11:42:52 +0000 2025,Pak Purbaya pasti masa mudanya jd fineshyt,pak purbaya pasti masa mudanya fineshyt,2,0,0,Pak Purbaya pasti masa mudanya jd fineshyt
1972627846423347403,Mon Sep 29 11:41:42 +0000 2025, Rokok Ilegal: Bisnis Gelap Triliunan Oknum Diduga Terlibat! Menteri Keuangan Purbaya Yudhi Sadewa menegaskan pemerintah akan menertibkan peredaran rokok ilegal yang merugikan negara hingga Rp97 81 triliun pada 2024. https://t.co/BXWb2oyiXl,rokok ilegal bisnis gelap triliunan oknum diduga terlibat menteri keuangan purbaya yudhi sadewa menegaskan pemerintah akan meneibkan peredaran rokok ilegal yang merugikan negara hingga triliun pada,0,3,0,Rokok Ilegal: Bisnis Gelap Triliunan Oknum Diduga Terlibat! Menteri Keuangan Purbaya Yudhi Sadewa menegaskan pemerintah akan menertibkan peredaran rokok ilegal yang merugikan negara hingga Rp97 81 triliun pada 2024. https://t.co/BXWb2oyiXl
1972627307346247936,Mon Sep 29 11:39:34 +0000 2025,@abu_waras Butuh waktu utk perbaiki perekonomian kita yg dirusak rejim bajingan tolol Mulyono. Tapi yg dibilang Purbaya logis kok. Dia munculnya telat aja,butuh waktu untuk perbaiki perekonomian kita yang dirusak rejim bajingan tolol mulyono tapi yang dibilang purbaya logis kok dia munculnya telat aja,9,0,0,@abu_waras Butuh waktu utk perbaiki perekonomian kita yg dirusak rejim bajingan tolol Mulyono. Tapi yg dibilang Purbaya logis kok. Dia munculnya telat aja
1972621672042906035,Mon Sep 29 11:17:10 +0000 2025,@liputan6dotcom Benarkah bahwa Kemenkeu kementrian keuangan. Berganti sifat menjadi Menko menteri ekonomi dibawah pengaruh Purbaya ,benarkah bahwa kemenkeu kementrian keuangan berganti sifat menjadi menko menteri ekonomi dibawah pengaruh purbaya,0,0,0,@liputan6dotcom Benarkah bahwa Kemenkeu kementrian keuangan. Berganti sifat menjadi Menko menteri ekonomi dibawah pengaruh Purbaya
1972621408800043214,Mon Sep 29 11:16:08 +0000 2025,Menteri Keuangan Purbaya Yudhi Sadewa menempatkan Rp200 triliun dana pemerintah di 5 bank nasional. Harapannya langkah ini bisa menurunkan suku bunga kredit dan menggerakkan kembali roda ekonomi. Tapi sejumlah pihak menilai kebijakan ini belum tentu efektif. Lesunya penyaluran https://t.co/9NFoIYWp1N,menteri keuangan purbaya yudhi sadewa menempatkan triliun dana pemerintah bank nasional harapannya langkah ini bisa menurunkan suku bunga kredit dan menggerakkan kembali roda ekonomi tapi sejumlah pihak menilai kebijakan ini belum tentu efektif lesunya penyaluran,15,8,4,Menteri Keuangan Purbaya Yudhi Sadewa menempatkan Rp200 triliun dana pemerintah di 5 bank nasional. Harapannya langkah ini bisa menurunkan suku bunga kredit dan menggerakkan kembali roda ekonomi. Tapi sejumlah pihak menilai kebijakan ini belum tentu efektif. Lesunya penyaluran https://t.co/9NFoIYWp1N
1972621364415623662,Mon Sep 29 11:15:57 +0000 2025,Kemenperin Purbaya Tak Naikkan Tarif Cukai Rokok 2026 https://t.co/sMFuCvq0CJ,kemenperin purbaya tak naikkan tarif cukai rokok,0,0,0,Kemenperin Purbaya Tak Naikkan Tarif Cukai Rokok 2026 https://t.co/sMFuCvq0CJ
1972621358225141993,Mon Sep 29 11:15:55 +0000 2025,Menteri Keuangan Purbaya Yudhi Sadewa resmi putuskan tidak menaikkan tarif cukai hasil tembakau (CHT) pada 2026. Keputusan ini diambil usai diskusi dengan produsen besar buruh pabrik petani tembakau hingga komunitas kretek. https://t.co/rJY3xNZlSP,menteri keuangan purbaya yudhi sadewa resmi putuskan tidak menaikkan tarif cukai hasil tembakau cht pada keputusan ini diambil usai diskusi dengan produsen besar buruh pabrik petani tembakau hingga komunitas kretek,0,4,0,Menteri Keuangan Purbaya Yudhi Sadewa resmi putuskan tidak menaikkan tarif cukai hasil tembakau (CHT) pada 2026. Keputusan ini diambil usai diskusi dengan produsen besar buruh pabrik petani tembakau hingga komunitas kretek. https://t.co/rJY3xNZlSP
1972618337592258853,Mon Sep 29 11:03:55 +0000 2025,@bangjohnaja @NasbiHasan Anaknya Purbaya bangga memiliki ayah yang pede dengan kinerjanya... Gw nggak yakin bang anak-anaknya si Nasbi akan bangga dengan cara bapaknya nyari duit...,anaknya purbaya bangga memiliki ayah yang pede dengan kinerjanya tidak yakin bang anakanaknya nasbi akan bangga dengan cara bapaknya nyari duit,1,1,0,@bangjohnaja @NasbiHasan Anaknya Purbaya bangga memiliki ayah yang pede dengan kinerjanya... Gw nggak yakin bang anak-anaknya si Nasbi akan bangga dengan cara bapaknya nyari duit...
1972612816361476206,Mon Sep 29 10:41:59 +0000 2025,@profesor_saham Anjay lord purbaya memang beda ,anjay lord purbaya memang beda,0,0,0,@profesor_saham Anjay lord purbaya memang beda
1972612567907578208,Mon Sep 29 10:41:00 +0000 2025,Dapatkan bonus 10.000 saldo pas install apk Shopeepay Caranyya: Upgrade ke spay plus log in dg shopee &amp; masukin kode referral FF6JWV5WP diskon promo info freelance job receh zonauang menpora erick thohir bahlil prabowo jokowi purbaya tasya farasya https://t.co/cziHHCGfVf https://t.co/vBkyapSyQJ,dapatkan bonus saldo pas install apk shopeepay caranyya upgrade spay plus log dengan shopee amp masukin kode referral ffjwvwp diskon promo info freelance job receh zonauang menpora erick thohir bahlil prabowo jokowi purbaya tasya farasya,1,0,0,Dapatkan bonus 10.000 saldo pas install apk Shopeepay Caranyya: Upgrade ke spay plus log in dg shopee &amp; masukin kode referral FF6JWV5WP diskon promo info freelance job receh zonauang menpora erick thohir bahlil prabowo jokowi purbaya tasya farasya https://t.co/cziHHCGfVf https://t.co/vBkyapSyQJ
1972611523907600603,Mon Sep 29 10:36:51 +0000 2025,Video: Purbaya Bantah Revisi UU P2SK Bakal Hilangkan Independensi BI https://t.co/Dqqyz3cGrO,video purbaya bantah revisi psk bakal hilangkan independensi,0,0,1,Video: Purbaya Bantah Revisi UU P2SK Bakal Hilangkan Independensi BI https://t.co/Dqqyz3cGrO
1972609800807530626,Mon Sep 29 10:30:00 +0000 2025,Misbakhun Apresiasi Presiden Prabowo dan Menkeu Purbaya Atas Tambahan Ruang Fiskal untuk Daerah #bahlillahadalia #kuningkeren #golkarindonesia #partaigolkar #golkarpedia https://t.co/YcdQywy7vy,misbakhun apresiasi presiden prabowo dan menkeu purbaya atas tambahan ruang fiskal untuk daerah,0,0,1,Misbakhun Apresiasi Presiden Prabowo dan Menkeu Purbaya Atas Tambahan Ruang Fiskal untuk Daerah      https://t.co/YcdQywy7vy
1972606443712037309,Mon Sep 29 10:16:40 +0000 2025,Menteri Keuangan (Menkeu) Purbaya Yudhi Sadewa menegaskan hingga kini belum ada pembahasan terkait pengganti Anggito Abimanyu yang resmi meninggalkan jabatannya sebagai Wakil Menteri Keuangan (Wamenkeu) setelah terpilih sebagai Ketua Dewan Komisioner Lembaga Penjamin Simpanan https://t.co/D2g1CI99mN,menteri keuangan menkeu purbaya yudhi sadewa menegaskan hingga kini belum ada pembahasan terkait pengganti anggito abimanyu yang resmi meninggalkan jabatannya sebagai wakil menteri keuangan wamenkeu setelah terpilih sebagai ketua dewan komisioner lembaga penjamin simpanan,0,0,0,Menteri Keuangan (Menkeu) Purbaya Yudhi Sadewa menegaskan hingga kini belum ada pembahasan terkait pengganti Anggito Abimanyu yang resmi meninggalkan jabatannya sebagai Wakil Menteri Keuangan (Wamenkeu) setelah terpilih sebagai Ketua Dewan Komisioner Lembaga Penjamin Simpanan https://t.co/D2g1CI99mN
1972604620020306308,Mon Sep 29 10:09:25 +0000 2025,@bengkeldodo @DedynurPalakka @diamukwarga_ @_luv_0499 @awikuchuz Purbaya gokil,purbaya gokil,0,0,0,@bengkeldodo @DedynurPalakka @diamukwarga_ @_luv_0499 @awikuchuz Purbaya gokil
1972604369079255413,Mon Sep 29 10:08:25 +0000 2025,@Metro_TV Pasti laporan nya yg baik2 doang. Panggil purbaya,pasti laporan nya yang baik doang panggil purbaya,0,0,0,@Metro_TV Pasti laporan nya yg baik2 doang. Panggil purbaya
1972602501951283497,Mon Sep 29 10:01:00 +0000 2025,Bonus pas download apk Shopeepay Rp. 10.000 saldo Caranyaa: Upgrade ke shopeepay plus log in pake akun shopee &amp; masukin kode referral FF6JWV5WP diskon promo info freelance job receh zonauang menpora erick thohir bahlil prabowo jokowi purbaya ferry https://t.co/jrJWpyIRFp,bonus pas download apk shopeepay saldo caranyaa upgrade shopeepay plus log pake akun shopee amp masukin kode referral ffjwvwp diskon promo info freelance job receh zonauang menpora erick thohir bahlil prabowo jokowi purbaya ferry,1,0,0,Bonus pas download apk Shopeepay Rp. 10.000 saldo Caranyaa: Upgrade ke shopeepay plus log in pake akun shopee &amp; masukin kode referral FF6JWV5WP diskon promo info freelance job receh zonauang menpora erick thohir bahlil prabowo jokowi purbaya ferry https://t.co/jrJWpyIRFp
1972602092335566943,Mon Sep 29 09:59:22 +0000 2025,Latar belakang keputusan Purbaya memang simpel. Waktu diskusi sama industri mereka cuma minta satu hal: Asal gak diubah sudah cukup. Purbaya jawab: Ya sudah saya gak ubah. ,latar belakang keputusan purbaya memang simpel waktu diskusi sama industri mereka cuma minta satu hal asal tidak diubah sudah cukup purbaya jawab sudah saya tidak ubah,0,1,0,Latar belakang keputusan Purbaya memang simpel. Waktu diskusi sama industri mereka cuma minta satu hal: Asal gak diubah sudah cukup. Purbaya jawab: Ya sudah saya gak ubah.
1972602077282177239,Mon Sep 29 09:59:19 +0000 2025,Setelah Menkeu Purbaya batalkan kenaikan cukai rokok 2026 sekarang industri rokok minta lebih: moratorium (freeze) cukai selama 3 tahun ke depan. Mereka bilang ini penting buat pemulihan industri.,setelah menkeu purbaya batalkan kenaikan cukai rokok sekarang industri rokok minta lebih moratorium freeze cukai selama tahun depan mereka bilang ini penting buat pemulihan industri,0,1,0,Setelah Menkeu Purbaya batalkan kenaikan cukai rokok 2026 sekarang industri rokok minta lebih: moratorium (freeze) cukai selama 3 tahun ke depan. Mereka bilang ini penting buat pemulihan industri.
1972597254998708566,Mon Sep 29 09:40:09 +0000 2025, Purbaya mengatakan ia salah menilai bahwa penyerapan anggaran MBG rendah. Usai bertemu Kepala BGN Dadan Hindayana pada Jumat lalu (26/9) ia mengatakan penyerapan anggaran program andalan Presiden Prabowo itu ternyata lebih bagus dari yang ia duga... https://t.co/LAaL7mxJah,purbaya mengatakan salah menilai bahwa penyerapan anggaran mbg rendah usai beemu kepala bgn dadan hindayana pada jumat lalu mengatakan penyerapan anggaran program andalan presiden prabowo itu ternyata lebih bagus dari yang duga,0,0,0,Purbaya mengatakan ia salah menilai bahwa penyerapan anggaran MBG rendah. Usai bertemu Kepala BGN Dadan Hindayana pada Jumat lalu (26/9) ia mengatakan penyerapan anggaran program andalan Presiden Prabowo itu ternyata lebih bagus dari yang ia duga... https://t.co/LAaL7mxJah
